{
  "artifact_type": "multi-actor-pilot",
  "pilot_id": "MAP-TASK-138-V117",
  "recorded_at": "2026-08-15T01:52:15.000Z",
  "work_item_id": "TASK-138",
  "work_item_ref": ".aof/tasks/done/TASK-138.json",
  "parent_orchestrator_ref": ".aof/tasks/done/TASK-138.json",
  "core_council_roles": [
    "visionary",
    "builder",
    "guardian"
  ],
  "actor_roster_ref": ".aof/organization.json",
  "actor_output_handoff_refs": [
    ".aof/artifacts/execution/role-results/RRES-TASK-138-VISIONARY.json",
    ".aof/artifacts/execution/role-results/RRES-TASK-138-BUILDER.json",
    ".aof/artifacts/execution/role-results/RRES-TASK-138-GUARDIAN.json"
  ],
  "council_judgment_ref": ".aof/artifacts/execution/council-reviews/CREV-TASK-138-V117.json",
  "work_execution_packet_ref": ".aof/artifacts/work-execution-packets/TASK-138.json",
  "maker_checker_council_boundary": "Builder made the audit surface, Guardian checked escalation/no-write boundaries, Council approved only bounded replay evidence.",
  "pilot_status": "ready",
  "not_proven": "Multi-actor pilot evidence does not prove independent third-party validation quality.",
  "source_task_id": "TASK-138",
  "source_parent_session_id": "SESS-V117-PROVIDER-READ-DECISION-REPLAY",
  "source_decision_record_id": null,
  "notes": null
}
