{
  "artifact_type": "multi-actor-pilot",
  "pilot_id": "MAP-MRJGP34X-WZF2CF",
  "recorded_at": "2026-07-13T16:53:54.849Z",
  "work_item_id": "TASK-094",
  "work_item_ref": ".aof/tasks/done/TASK-094.json",
  "pilot_status": "completed",
  "parent_orchestrator_ref": ".aof/artifacts/agent-sessions/SESS-V75-REQUIREMENT-COVERAGE.json",
  "core_council_roles": [
    "visionary",
    "builder",
    "guardian"
  ],
  "actor_roster_ref": ".aof/artifacts/execution/actor-rosters/TASK-094.json",
  "actor_output_handoff_refs": [
    ".aof/artifacts/execution/role-results/RRES-MRJGKLR5-1CCPMY.json",
    ".aof/artifacts/execution/role-results/RRES-MRJGL2E6-56J2KI.json",
    ".aof/artifacts/execution/role-results/RRES-MRJGKNN9-J5J2WC.json"
  ],
  "council_judgment_ref": ".aof/artifacts/execution/council-reviews/CREV-TASK-094-V75.json",
  "work_execution_packet_ref": ".aof/artifacts/work-execution-packets/TASK-094.json",
  "maker_checker_council_boundary": "Builder makes the coverage implementation, Guardian checks evidence boundaries, and Architecture Council approves release readiness.",
  "not_proven": "Multi-Actor Pilot evidence does not prove autonomous workforce performance or semantic correctness.",
  "source_task_id": "TASK-094",
  "source_parent_session_id": "SESS-V75-REQUIREMENT-COVERAGE",
  "source_decision_record_id": null,
  "notes": null
}
