{
  "artifact_type": "multi-actor-pilot",
  "pilot_id": "MAP-TASK-116-V96",
  "recorded_at": "2026-07-24T02:00:36.000Z",
  "work_item_id": "TASK-116",
  "work_item_ref": ".aof/tasks/done/TASK-116.json",
  "pilot_status": "completed",
  "parent_orchestrator_ref": ".aof/artifacts/agent-sessions/SESS-V96-COST-QUOTA.json",
  "core_council_roles": ["visionary", "builder", "guardian"],
  "actor_roster_ref": ".aof/artifacts/execution/team-outputs/TOUT-TASK-116-V96.json",
  "actor_output_handoff_refs": [
    ".aof/artifacts/execution/role-results/RRES-TASK-116-VISIONARY.json",
    ".aof/artifacts/execution/role-results/RRES-TASK-116-BUILDER.json",
    ".aof/artifacts/execution/role-results/RRES-TASK-116-GUARDIAN.json"
  ],
  "council_judgment_ref": ".aof/artifacts/execution/council-reviews/CREV-TASK-116-V96.json",
  "work_execution_packet_ref": ".aof/artifacts/work-execution-packets/TASK-116.json",
  "maker_checker_council_boundary": "Builder implements the cost/quota contract, Guardian verifies incomplete cost/quota evidence blocks execution, Product Council approves bounded release framing.",
  "not_proven": "Multi-actor evidence proves governed handoff only, not actual provider billing correctness.",
  "source_task_id": "TASK-116",
  "source_parent_session_id": "SESS-V96-COST-QUOTA",
  "source_decision_record_id": null,
  "notes": null
}
