{
  "artifact_type": "multi-actor-pilot",
  "pilot_id": "MAP-TASK-123-V103",
  "recorded_at": "2026-08-02T01:30:23.064Z",
  "work_item_id": "TASK-123",
  "work_item_ref": ".aof/tasks/done/TASK-123.json",
  "pilot_status": "completed",
  "parent_orchestrator_ref": ".aof/artifacts/agent-sessions/SESS-V101-THIRD-PARTY-VALIDATION.json",
  "core_council_roles": [
    "visionary",
    "builder",
    "guardian"
  ],
  "actor_roster_ref": ".aof/artifacts/execution/team-outputs/TOUT-TASK-121-V101.json",
  "actor_output_handoff_refs": [
    ".aof/artifacts/execution/role-results/RRES-TASK-121-VISIONARY.json",
    ".aof/artifacts/execution/role-results/RRES-TASK-121-BUILDER.json",
    ".aof/artifacts/execution/role-results/RRES-TASK-121-GUARDIAN.json"
  ],
  "council_judgment_ref": ".aof/artifacts/execution/council-reviews/CREV-TASK-121-V101.json",
  "work_execution_packet_ref": ".aof/artifacts/work-execution-packets/TASK-121.json",
  "maker_checker_council_boundary": "Builder assembles validation contract evidence, Guardian verifies external-proof boundaries, Architecture Council decides whether the validation contract is release-grade.",
  "not_proven": "This v10.3 evidence proves a production execution authorization model only; it does not prove live provider execution, provider write safety, production credential safety, billing safety, incident recovery performance, or third-party validation completion.",
  "source_task_id": "TASK-123",
  "source_parent_session_id": "SESS-V103-PROD-AUTH-MODEL",
  "source_decision_record_id": null,
  "notes": null
}
