{
  "artifact_type": "multi-actor-pilot",
  "pilot_id": "MAP-MRR4XTHT-H3VP5T",
  "recorded_at": "2026-07-19T01:46:56.273Z",
  "work_item_id": "TASK-102",
  "work_item_ref": ".aof/tasks/done/TASK-102.json",
  "pilot_status": "completed",
  "parent_orchestrator_ref": ".aof/artifacts/agent-sessions/SESS-V82-OPERATOR-VALIDATION.json",
  "core_council_roles": [
    "visionary",
    "builder",
    "guardian"
  ],
  "actor_roster_ref": ".aof/artifacts/execution/actor-rosters/TASK-102.json",
  "actor_output_handoff_refs": [
    ".aof/artifacts/execution/role-results/RRES-TASK-102-BUILDER.json",
    ".aof/artifacts/execution/role-results/RRES-TASK-102-GUARDIAN.json"
  ],
  "council_judgment_ref": ".aof/artifacts/execution/council-reviews/CREV-TASK-102-V82.json",
  "work_execution_packet_ref": ".aof/artifacts/work-execution-packets/TASK-102.json",
  "maker_checker_council_boundary": "Builder makes the operator validation surface, Guardian checks it, Council approves release use.",
  "not_proven": "Multi-actor pilot proves governed handoff structure only.",
  "source_task_id": "TASK-102",
  "source_parent_session_id": "SESS-V82-OPERATOR-VALIDATION",
  "source_decision_record_id": null,
  "notes": null
}
