{
  "artifact_type": "multi-actor-pilot",
  "pilot_id": "MAP-TASK-133-V112",
  "recorded_at": "2026-08-14T01:44:05.000Z",
  "work_item_id": "TASK-133",
  "work_item_ref": ".aof/tasks/done/TASK-133.json",
  "pilot_status": "ready",
  "parent_orchestrator_ref": ".aof/tasks/done/TASK-133.json",
  "core_council_roles": [
    "visionary",
    "builder",
    "guardian"
  ],
  "actor_roster_ref": ".aof/organization.json",
  "actor_output_handoff_refs": [
    ".aof/artifacts/execution/role-results/RRES-TASK-133-VISIONARY.json",
    ".aof/artifacts/execution/role-results/RRES-TASK-133-BUILDER.json",
    ".aof/artifacts/execution/role-results/RRES-TASK-133-GUARDIAN.json"
  ],
  "council_judgment_ref": ".aof/artifacts/execution/council-reviews/CREV-TASK-133-V112.json",
  "work_execution_packet_ref": ".aof/artifacts/work-execution-packets/TASK-133.json",
  "maker_checker_council_boundary": "Builder assembles the provider read integration, Guardian verifies no-write and overclaim boundaries, and Council approves only bounded read-only integration proof.",
  "not_proven": "Multi-actor pilot proves role handoff and Council judgment for v11.2 only; it does not prove provider semantic truth or write safety.",
  "source_task_id": "TASK-133",
  "source_parent_session_id": "SESS-V112-PROVIDER-READ-INTEGRATION",
  "source_decision_record_id": null,
  "notes": null
}
